{
  "bestatt": true,
  "krav_id": "m19-fasit-v1",
  "maalt": {
    "avviksliste": [],
    "evidens_delte_input_hash": 0,
    "evidens_per_handling": {
      "adresse_registrert": 6,
      "adressekontroll_registrert": 4,
      "adressekrav_satt": 1,
      "adressesubjekt_opprettet": 6
    },
    "evidens_totalt": 17,
    "evidens_uten_aktor": 0,
    "funnavvik": 0,
    "funnavvik_etter_andre": 0,
    "per_subjekt": [
      {
        "fikk": [
          "ukontrollert_adresse"
        ],
        "merke": "ukontrollert",
        "subjekt_id": "7fa78432-e9a9-4739-8fad-c63774173852",
        "ventet": "ukontrollert_adresse"
      },
      {
        "fikk": [
          "kontroll_utlopt"
        ],
        "merke": "utlopt",
        "subjekt_id": "998a11ba-5e5e-4cf5-8335-1eb73f2f15c5",
        "ventet": "kontroll_utlopt"
      },
      {
        "fikk": [
          "avvist_adresse"
        ],
        "merke": "avvist",
        "subjekt_id": "ec5ba1c1-bd86-41ac-8d2d-e081f02443ac",
        "ventet": "avvist_adresse"
      },
      {
        "fikk": [
          "utilstrekkelig_metode"
        ],
        "merke": "feil_metode",
        "subjekt_id": "8e72a512-1b85-4646-8a2d-4d0668201725",
        "ventet": "utilstrekkelig_metode"
      },
      {
        "fikk": [],
        "merke": "ren",
        "subjekt_id": "0b4ad7ef-1b0b-4aad-b97d-9daca5336d29",
        "ventet": null
      },
      {
        "fikk": [
          "ingen_krav"
        ],
        "merke": "ingen_krav",
        "subjekt_id": "f9ff4dfc-a2c8-4055-abfd-283dc0db3930",
        "ventet": "ingen_krav"
      }
    ],
    "rent_funn_for_kontroll": 1,
    "subjekter": 6,
    "sveip1_nye": 6,
    "sveip1_tenanter": 3,
    "sveip2_lukkede": 1,
    "sveip2_nye": 0,
    "sveip2_oppdaterte": 5
  },
  "oppsett": {
    "bevisrot_sha256": "17266978ce13797577cbb68a96ec10bf0cd54d22f4f3687067ef626ed9bcc7ef",
    "godkjente_metoder": [
      "dokumentert",
      "levering_bekreftet"
    ],
    "gyldig_dogn": 180,
    "modul": "m19_adresse",
    "runde": "9a5defa6",
    "sett_sha256": "2d451c7db54839e16b1008b60f7ceba2f99586eaa03dd1d8dc3eea8c8c293ddc",
    "tenanter": [
      "t-m19fasit-med_krav-9a5defa6",
      "t-m19fasit-uten_krav-9a5defa6"
    ],
    "ukontrollert_dogn": 30,
    "vert": "disponit.com"
  },
  "ts": "2026-09-17T22:46:53.329524+00:00"
}
